{
  "checked_paths": [
    "schemas/skill-kernel/examples/research-distillation-workflow-contract.kernel.json",
    "profiles/profile-index.yaml",
    "profiles/research-distillation/examples/workflow-contract-routing-evals.json",
    "profiles/research-distillation/examples/workflow-contract-trials/assessment.md",
    "profiles/research-distillation/templates/workflow-contract.md",
    "skills/advisor-update-writer/SKILL.md",
    "skills/advisor-update-writer/references/decision-framing.md",
    "skills/advisor-update-writer/references/memory-writeback.md",
    "skills/advisor-update-writer/references/update-template.md",
    "skills/paper-writing-assistant/SKILL.md",
    "skills/paper-writing-assistant/references/edit-whitelist-contract.md",
    "skills/paper-writing-assistant/references/evidence-recipes.md",
    "skills/paper-writing-assistant/references/exemplar-index.md",
    "skills/paper-writing-assistant/references/exemplars/acl-2022-truthfulqa-benchmark.md",
    "skills/paper-writing-assistant/references/exemplars/cvpr-2022-latent-diffusion-method.md",
    "skills/paper-writing-assistant/references/exemplars/iccv-2023-segment-anything-benchmark.md",
    "skills/paper-writing-assistant/references/exemplars/iclr-2017-rethinking-generalization-analysis.md",
    "skills/paper-writing-assistant/references/exemplars/iclr-2022-lora-method.md",
    "skills/paper-writing-assistant/references/exemplars/naacl-2019-bert-method.md",
    "skills/paper-writing-assistant/references/exemplars/neurips-2020-ddpm-method.md",
    "skills/paper-writing-assistant/references/exemplars/neurips-2021-mlp-mixer-method.md",
    "skills/paper-writing-assistant/references/exemplars/sc20-zero-systems.md",
    "skills/paper-writing-assistant/references/micro-patterns/figure-captions.md",
    "skills/paper-writing-assistant/references/micro-patterns/paragraph-openings-closings.md",
    "skills/paper-writing-assistant/references/micro-patterns/result-interpretation.md",
    "skills/paper-writing-assistant/references/micro-patterns/table-captions.md",
    "skills/paper-writing-assistant/references/micro-patterns/transitions-and-positioning.md",
    "skills/paper-writing-assistant/references/paper-quality-heuristics.md",
    "skills/paper-writing-assistant/references/section-patterns/abstract.md",
    "skills/paper-writing-assistant/references/section-patterns/experiments-results.md",
    "skills/paper-writing-assistant/references/section-patterns/introduction.md",
    "skills/paper-writing-assistant/references/section-patterns/limitations-conclusion.md",
    "skills/paper-writing-assistant/references/section-patterns/method.md",
    "skills/paper-writing-assistant/references/section-patterns/related-work.md",
    "skills/paper-writing-assistant/references/style-selection.md",
    "skills/sidecar-task-runner/SKILL.md",
    "skills/sidecar-task-runner/agents/openai.yaml",
    "skills/sidecar-task-runner/scripts/prepare_sidecar_task.py",
    "skills/sidecar-task-runner/templates/personalization-scanner.md",
    "skills/sidecar-task-runner/templates/precommit-classifier.md",
    "skills/work-timeline-planner/SKILL.md",
    "skills/work-timeline-planner/references/evidence-model.md",
    "skills/work-timeline-planner/references/output-formats.md",
    "skills/work-timeline-planner/references/report-modes.md",
    "skills/work-timeline-planner/templates/timeline-report.html",
    "skills/work-timeline-planner/templates/timeline-report.md",
    "skills/discovery-router/SKILL.md",
    "skills/discovery-router/references/contrastive-routing.md",
    "skills/discovery-router/references/route-table.md",
    "skills/literature-review-sprint/SKILL.md",
    "skills/literature-review-sprint/references/memory-writeback.md",
    "skills/literature-review-sprint/references/paper-taxonomy.md",
    "skills/literature-review-sprint/references/reading-priority.md",
    "skills/literature-review-sprint/references/search-protocol.md",
    "skills/literature-review-sprint/references/synthesis-template.md",
    "skills/memory-publication-auditor/SKILL.md",
    "skills/memory-publication-auditor/agents/openai.yaml",
    "skills/memory-publication-auditor/references/classification-policy.md",
    "skills/memory-publication-auditor/scripts/scan_publication_candidates.py",
    "skills/memory-publication-auditor/templates/audit-report.md",
    "skills/memory-publication-auditor/templates/publication-candidate.md",
    "skills/personalization-memory/SKILL.md",
    "skills/personalization-memory/agents/openai.yaml",
    "skills/personalization-memory/references/trajectory-scanner.md",
    "skills/personalization-memory/references/writeback-policy.md",
    "skills/personalization-memory/templates/preference-ledger.md",
    "skills/reference-corpus-analyzer/SKILL.md",
    "skills/reference-corpus-analyzer/templates/comparison-matrix.md",
    "skills/reference-library-manager/SKILL.md",
    "skills/reference-library-manager/agents/openai.yaml",
    "skills/reference-library-manager/references/library-policy.md",
    "skills/reference-library-manager/scripts/scan_reference_library.py",
    "skills/reference-library-manager/templates/reading-status.md",
    "skills/reference-library-manager/templates/reference-index.md",
    "skills/reference-project-synthesizer/SKILL.md",
    "skills/reference-project-synthesizer/agents/openai.yaml",
    "skills/reference-project-synthesizer/references/project-link-routing.md",
    "skills/reference-project-synthesizer/templates/project-use-note.md",
    "skills/reference-reading-summarizer/SKILL.md",
    "skills/reference-reading-summarizer/agents/openai.yaml",
    "skills/reference-reading-summarizer/references/model-routing.md",
    "skills/reference-reading-summarizer/references/reading-modes.md",
    "skills/reference-reading-summarizer/templates/paper-card.md",
    "skills/reference-reading-summarizer/templates/reading-run.md",
    "skills/reference-reading-summarizer/templates/source-card.md",
    "skills/skill-system-auditor/SKILL.md",
    "skills/skill-system-auditor/references/agent-regression-hardening.md",
    "skills/skill-system-auditor/references/audit-rubric.md",
    "skills/skill-system-auditor/references/doc-sync-map.md",
    "skills/skill-system-auditor/references/report-template.md"
  ],
  "hits": [],
  "ignored_paths": [
    ".agent/sidecars/",
    "memory/",
    "*/.DS_Store",
    "*/__pycache__/*"
  ],
  "inventory_path": "schemas/skill-kernel/repo-split/research-distillation-source-inventory-2026-05-28.json",
  "kernel_id": "research-distillation-workflow-contract",
  "patterns_scanned": [
    {
      "id": "absolute-mac-home",
      "pattern": "/Users/[A-Za-z0-9._-]+/",
      "rationale": "Absolute macOS home paths leak machine-specific user identity."
    },
    {
      "id": "absolute-linux-home",
      "pattern": "/home/[A-Za-z0-9._-]+/",
      "rationale": "Absolute Linux home paths leak machine-specific user identity."
    },
    {
      "id": "sidecar-private-path",
      "pattern": "\\.agent/sidecars/[A-Za-z0-9][A-Za-z0-9._-]{4,}/",
      "rationale": "Concrete sidecar artifact paths (with a real task id segment) are local-only and must not enter a public split repo. Placeholder forms like `.agent/sidecars/<task-id>/` are documented conventions and are not matched by this pattern."
    },
    {
      "id": "ssh-private-key-block",
      "pattern": "-----BEGIN [A-Z ]*PRIVATE KEY-----",
      "rationale": "Private key material must never be copied."
    },
    {
      "id": "openssh-public-marker",
      "pattern": "ssh-(rsa|ed25519|ecdsa) AAAA",
      "rationale": "Hard-coded public keys often indicate accidental key material copy."
    },
    {
      "id": "aws-access-key-id",
      "pattern": "AKIA[0-9A-Z]{16}",
      "rationale": "AWS access key IDs are credentials."
    },
    {
      "id": "github-token-prefix",
      "pattern": "gh[pousr]_[A-Za-z0-9]{20,}",
      "rationale": "GitHub personal access / OAuth tokens are credentials."
    },
    {
      "id": "anthropic-api-key",
      "pattern": "sk-ant-[A-Za-z0-9_-]{20,}",
      "rationale": "Anthropic API keys are credentials."
    },
    {
      "id": "user-email-kaust",
      "pattern": "[A-Za-z0-9._%+-]+@kaust\\.edu\\.sa",
      "rationale": "Personal institutional email leaks user identity."
    },
    {
      "id": "user-email-northwestern",
      "pattern": "[A-Za-z0-9._%+-]+@northwestern\\.edu",
      "rationale": "Personal institutional email leaks user identity."
    },
    {
      "id": "user-email-epfl",
      "pattern": "[A-Za-z0-9._%+-]+@epfl\\.ch",
      "rationale": "Personal institutional email leaks user identity."
    }
  ],
  "profile": "research-distillation",
  "schema_version": "0.1",
  "status": "passed",
  "summary": "no credential / private-path / personal-identifier hits in the proposed split set"
}
